在进行年度财务报表审计时，为了证实被审计单位在临近 12 月 31 日签发的支票未予入账，注册会计师可以实施的审计程序有( )。 ,函证 12 月 31 日的银行存款余额,审查 12 月份的支票存根,审查 12 月 31 日的银行对账单,审查 12 月 31 日的银行存款余额调节表,第十二章 货币资金的审计,A,如果在完成审计工作后发现舞弊导致的财务报表重大错报， 特别是串通舞弊或伪造文件记录导致的重大错报，并不一定表明注册会计师没有遵守审 计准则，所以选项 A 错误。【知识点】注册会计师的责任,<a href="http://www.zgcjpx.com/cpa/tiku/lianxi/sj/136603.html">2020年注册会计师考试《审计》每日一练(7-10)</a>,多选 审计
注册会计师寄发的银行询证函( )。 ,属于积极式函证,要求银行直接回函至会计师事务所,是以被审计单位的名义发往开户银行,函证对象包括银行存款和借款余额等,第十二章 货币资金的审计,A,编制虚假财务报告导致的重大错报风险与侵占资产导致的重大错报风险之间没有明显的大小关系，侵占资产通常伴随着虚假或误导性的文件记录。【知识点】舞弊风险,<a href="http://www.zgcjpx.com/cpa/tiku/lianxi/sj/136603.html">2020年注册会计师考试《审计》每日一练(7-10)</a>,多选 审计
当被审计单位可能存在资金体外循环时，注册会计师针对银行账户实施的审计程序正确的有( )。 ,了解并评价被审计单位开立账户的管理控制措施,关注原始单据中收付款银行账户是否包含已经获取的开立银行账户清单内,询问出纳人员了解银行账户的开立、使用、注销等情况,对被审计单位记录的所有银行存款账户实施函证,第十二章 货币资金的审计,B,舞弊者具有舞弊的动机是舞弊发生的首要条件。【知识点】舞弊风险三角模型,<a href="http://www.zgcjpx.com/cpa/tiku/lianxi/sj/136603.html">2020年注册会计师考试《审计》每日一练(7-10)</a>,多选 审计
编制虚假财务报告，可能源于管理层通过操纵利润误导财务报表使用者对被审计 单位业绩或盈利能力的判断，通过编制虚假财务报告以达到舞弊目的的手段不包括( )。,对交易、事项或其他重要信息在财务报表中的不真实表达或故意遗漏,对财务报表所依据的会计记录或相关文件记录的操纵.伪造或篡改,对与确认、计量、分类或披露有关的会计政策和会计估计的故意误用,管理层在购货时收取回扣,第十三章 对舞弊和法律法规的考虑,D,选项 A、C 属于舞弊的动机，选项 B 属于舞弊的机会。【知识点】舞弊风险三角模型,<a href="http://www.zgcjpx.com/cpa/tiku/lianxi/sj/136603.html">2020年注册会计师考试《审计》每日一练(7-10)</a>,单选 审计
针对舞弊导致的重大错报风险，下列说法中正确的是( )。(2015 年),被审计单位管理层对防止或发现舞弊负有全部责任,注册会计师对财务报表整体存在由于舞弊或错误导致的重大错报获取合理保证,未发现被审计单位的舞弊行为，表明注册会计师工作失误,注册会计师不能对财务报表整体不存在重大错报获取绝对保证,第十三章 对舞弊和法律法规的考虑,C,选项 A、B 属于机会舞弊风险因素;选项D 属于态度或借口舞弊风险因素。【知识点】舞弊风险三角模型,<a href="http://www.zgcjpx.com/cpa/tiku/lianxi/sj/136603.html">2020年注册会计师考试《审计》每日一练(7-10)</a>,单选 审计
在进行年度财务报表审计时，为了证实被审计单位在临近 12 月 31 日签发的支票未予入账，注册会计师可以实施的审计程序有( )。 ,函证 12 月 31 日的银行存款余额,审查 12 月份的支票存根,审查 12 月 31 日的银行对账单,审查 12 月 31 日的银行存款余额调节表,第十二章 货币资金的审计,ABCD,如持票人于 12 月 31 日以前到银行办完相关手续，则选项 ACD 都是有效的;另一方面，无论持票人何时办完相关手续，其年前签发的支票均可以通过检查支票存根加以证实(因存根有连续编号)。【知识点】银行存款的实质性程序,<a href="http://www.zgcjpx.com/cpa/tiku/lianxi/sj/136338.html">2020年注册会计师考试《审计》每日一练(7-9)</a>,多选 审计
注册会计师寄发的银行询证函( )。 ,属于积极式函证,要求银行直接回函至会计师事务所,是以被审计单位的名义发往开户银行,函证对象包括银行存款和借款余额等,第十二章 货币资金的审计,ABCD,选项 ABCD 均属于银行询证函的特点。【知识点】银行存款的实质性程序 函证,<a href="http://www.zgcjpx.com/cpa/tiku/lianxi/sj/136338.html">2020年注册会计师考试《审计》每日一练(7-9)</a>,多选 审计
当被审计单位可能存在资金体外循环时，注册会计师针对银行账户实施的审计程序正确的有( )。 ,了解并评价被审计单位开立账户的管理控制措施,关注原始单据中收付款银行账户是否包含已经获取的开立银行账户清单内,询问出纳人员了解银行账户的开立、使用、注销等情况,对被审计单位记录的所有银行存款账户实施函证,第十二章 货币资金的审计,ABC,选项 D 可以证实存在认定，无法证实完整性认定。【知识点】银行存款的实质性程序,<a href="http://www.zgcjpx.com/cpa/tiku/lianxi/sj/136338.html">2020年注册会计师考试《审计》每日一练(7-9)</a>,多选 审计
编制虚假财务报告，可能源于管理层通过操纵利润误导财务报表使用者对被审计 单位业绩或盈利能力的判断，通过编制虚假财务报告以达到舞弊目的的手段不包括( )。,对交易、事项或其他重要信息在财务报表中的不真实表达或故意遗漏,对财务报表所依据的会计记录或相关文件记录的操纵.伪造或篡改,对与确认、计量、分类或披露有关的会计政策和会计估计的故意误用,管理层在购货时收取回扣,第十三章 对舞弊和法律法规的考虑,D,选项 ABC 是管理层编制虚假财务报告的通常表现，选项 D是侵占资产中的舞弊手段。【知识点】舞弊的种类,<a href="http://www.zgcjpx.com/cpa/tiku/lianxi/sj/136338.html">2020年注册会计师考试《审计》每日一练(7-9)</a>,单选 审计
针对舞弊导致的重大错报风险，下列说法中正确的是( )。(2015 年),被审计单位管理层对防止或发现舞弊负有全部责任,注册会计师对财务报表整体存在由于舞弊或错误导致的重大错报获取合理保证,未发现被审计单位的舞弊行为，表明注册会计师工作失误,注册会计师不能对财务报表整体不存在重大错报获取绝对保证,第十三章 对舞弊和法律法规的考虑,D,被审计单位治理层和管理层对防止或发现舞弊负有主要责任(A);注册会计师对财务报表整体是否不存在由于舞弊或错误导致的重大错报获取合 理保证(B);如果在完成审计工作后发现舞弊导致的财务报表重大错报，特别是串通舞弊或伪造文件记录导致的重大错报，并不必然表明注册会计师没有遵守审计准则(C)。【知识点】治理层、管理层的责任 注册会计师的责任,<a href="http://www.zgcjpx.com/cpa/tiku/lianxi/sj/136338.html">2020年注册会计师考试《审计》每日一练(7-9)</a>,单选 审计
下列审计程序中，通常不能为定期存款的存在认定提供可靠的审计证据的是( )。(2016 年) ,对未质押的定期存款检查开户证书原件,函证定期存款的相关信息,对于资产负债表日后到期的定期存款，核对兑付凭证,对已质押的定期存款，检查定期存单复印件,第十二章 货币资金的审计,D,对已质押的定期存款，检查定期存单复印件，并与相应的质押合同核对，因为定期存单的复印件可靠性相对较低，可能存在复印件造假的情况。【知识点】银行存款的实质性程序,<a href="http://www.zgcjpx.com/cpa/tiku/lianxi/sj/135323.html">2020年注册会计师考试《审计》每日一练(7-6)</a>,单选 审计
甲公司编制的 2011 年12 月末银行存款余额调节表显示存在 120 000 元的未达账项，其中包括甲公司已付而银行未付的材料采购款 100 000 元。以下审计程序中，为该材料采购款未达账项的真实性提供的审计证据无效的是( )。,检查 2012 年 1 月份的银行对账单,检查相关的采购合同、供应商销售发票和付款审批手续,就 2011 年 12 月末银行存款余额向银行寄发银行询证函,向相关的原材料供应商寄发询证函,第十二章 货币资金的审计,C,由于在 12 月末供应商尚未办理转账，所以向银行函证 12月末的银行存款余额是无效的。【知识点】银行存款的实质性程序 银行存款余额调节表,<a href="http://www.zgcjpx.com/cpa/tiku/lianxi/sj/135323.html">2020年注册会计师考试《审计》每日一练(7-6)</a>,单选 审计
N 公司某银行账户的银行对账单余额为 585 000 元，在审查 N 公司编制的该账户银行存款余额调节表时，A 注册会计师注意到以下事项：N 公司已收、银行尚未入账的某公司销货款 100 000 元;N 公司已付、银行尚未入账的预付某公司材料款 50 000 元;银行已收、N 公司尚未入账的某公司退回的押金 35 000 元;银行已代扣、N 公司尚未入账的水电费 25 000 元。假定不考虑审计重要性水平，A 注册会计师审计后确认该账户的银行存款日记账余额应是( )元。,625 000,635 000,575 000,595 000,第十二章 货币资金的审计,B,确认的银行存款日记账余额=585 000+100 000-50 000=635 000(元)。【知识点】银行存款的实质性程序 银行存款余额调节表,<a href="http://www.zgcjpx.com/cpa/tiku/lianxi/sj/135323.html">2020年注册会计师考试《审计》每日一练(7-6)</a>,单选 审计
N 公司某银行账户的银行存款对账单余额与银行存款日记账余额不符，A 注册会计师应当执行的最有效的审计程序是( )。,重新测试相关的内部控制,审查银行对账单中记录的该账户资产负债表日前后的收付情况,审查银行存款日记账中记录的该账户资产负债表日前后的收付情况,审查该账户的银行存款余额调节表,第十二章 货币资金的审计,D,对于银行账户的银行对账单余额与银行存款日记账余额不符最有可能是由于未达账项引起的，所以审查该账户的银行存款余额调节表是最有效的 审计程序。【知识点】银行存款的实质性程序,<a href="http://www.zgcjpx.com/cpa/tiku/lianxi/sj/135323.html">2020年注册会计师考试《审计》每日一练(7-6)</a>,单选 审计
针对被审计单位银行账户的完整性认定，注册会计师实施的下列审计程序中， 可能不能发现被审计单位存在账外账或资金体外循环的是( )。,结合其他相关细节测试，关注原始单据中被审计单位的付款银行账户是否包含在 注册会计师已获取的开立银行账户清单内,注册会计师亲自到中国人民银行或基本存款账户开户行查询并打印《已开立银行 结算账户清单》，以确认被审计单位账面记录的银行人民币结算账户是否完整,要求被审计单位出纳到人民银行或基本存款账户开户行查询并打印《已开立银行 结算账户清单》，以确认被审计单位账面记录的银行人民币结算账户是否完整,结合其他相关细节测试，关注原始单据中被审计单位的收款银行账户是否包含在 注册会计师已获取的开立银行账户清单内,第十二章 货币资金的审计,C,注册会计师亲自到人民银行或基本存款账户开户行查询并打印《已开立银行结算账户清单》，以确认被审计单位账面记录的银行人民币结算账户 是否完整，选项 C 错误。【知识点】银行存款的实质性程序,<a href="http://www.zgcjpx.com/cpa/tiku/lianxi/sj/135323.html">2020年注册会计师考试《审计》每日一练(7-6)</a>,单选 审计
注册会计师实施的下列针对银行存款账户发生额的审计程序中，不正确的是( )。 ,分析不同账户发生银行存款日记账漏记银行交易的可能性，获取相关账户相关期 间的全部银行对账单,如果对被审计单位银行对账单的真实性存有疑虑，可以再次从被审计单位获取银 行对账单,从被审计单位银行存款日记账上选取样本，核对至银行对账单,浏览银行对账单，选取大额异常交易,第十二章 货币资金的审计,B,如果对被审计单位银行对账单的真实性存有疑虑，注册会计 师可以在被审计单位的协助下亲自到银行获取银行对账单，在获取银行对账单时，注册 会计师要全程关注银行对账单的打印过程，选项 B 错误。【知识点】银行存款的实质性程序,<a href="http://www.zgcjpx.com/cpa/tiku/lianxi/sj/135729.html">2020年注册会计师考试《审计》每日一练(7-7)</a>,单选 审计
函证银行存款余额的说法中，不恰当的是( )。,银行函证程序是证实资产负债表所列银行存款是否存在的重要程序,如果不对这些项目实施函证程序，注册会计师应当在审计工作底稿中说明理由,在实施银行函证时，注册会计师需要以会计师事务所名义向银行发函询证,当实施函证程序时，注册会计师应当对询证函保待控制,第十二章 货币资金的审计,C,选项 C 不恰当，在实施银行函证时，注册会计师需要以被审计单位名义向银行发函询证，以验证被审计单位的银行存款是否真实、合法、完整。【知识点】银行存款的实质性程序,<a href="http://www.zgcjpx.com/cpa/tiku/lianxi/sj/135729.html">2020年注册会计师考试《审计》每日一练(7-7)</a>,单选 审计
针对甲公司下列与库存现金相关的内部控制，A 注册会计师认为正确的有( )。,每日及时记录现金收入并定期向顾客寄送对账单,担任登记现金日记账的人员负责登记现金总账,	现金折扣需经过适当审批,每日盘点库存现金并与账面余额核对,第十二章 货币资金的审计,ACD,选项 B 中担任登记现金日记账的人员不能同时登记总账。【知识点】货币资金相关内部控制,<a href="http://www.zgcjpx.com/cpa/tiku/lianxi/sj/135729.html">2020年注册会计师考试《审计》每日一练(7-7)</a>,多选 审计
针对被审计单位以下与货币资金相关的内部控制，注册会计师应提出改进建议的 有( )。,现金收入必须及时存入银行，不得直接用于公司的支出,在办理费用报销的付款手续后，出纳人员应及时登记现金、银行存款日记账和相 关费用明细账,出纳人员应当根据复核无误的支付申请，按规定办理货币资金支付手续，及时登 记库存现金和银行存款日记账,期末应当核对银行存款日记账余额和银行对账单余额，对余额核对相符的银行存 款账户，无需编制银行存款余额调节表,第十二章 货币资金的审计,BD,选项 B，登记库存现金日记账、银行存款日记账和相关费用明细账是不相容职责，不能由现金出纳一人负责，应当提出建议;选项 D 无论余额核对是否相符，均需编制银行存款余额调节表，应当提出建议。【知识点】货币资金相关内部控制,<a href="http://www.zgcjpx.com/cpa/tiku/lianxi/sj/135729.html">2020年注册会计师考试《审计》每日一练(7-7)</a>,多选 审计
在货币资金审计中，注册会计师需要保持警觉的情形包括( )。,被审计单位的现金交易比例较高，并与其所在的行业常用的结算模式相同,货币资金收支金额与现金流量表不匹配,不能提供银行对账单或银行存款余额调节表,银行承兑票据保证金余额与应付票据余额比例不合理,第十二章 货币资金的审计,BCD,选项 A，如果是被审计单位的现金交易比例较高，并与其所在的行业常用的结算模式不同，那么要保持警觉。【知识点】货币资金的重大错报风险,<a href="http://www.zgcjpx.com/cpa/tiku/lianxi/sj/135729.html">2020年注册会计师考试《审计》每日一练(7-7)</a>,多选 审计
下列有关货币资金的实质性程序的说法中，不正确的有( )。,制定库存现金监盘程序时应实施突击性检查，时间必须安排在上午上班前或下午 下班时进行，在进行现金盘点前，应由出纳员将现金集中起来存入保险柜,对于货币资金业务的授权审批制度，企业应当设置专门的审批人员，并为其授予 审批权限，对于超过该审批人员授权范围的重要货币资金支付业务，应当由财务部经理 或者总经理亲自审核批准,盘点库存现金的时间和人员应视被审计单位的具体情况而定，但必须有出纳员和 被审计单位会计主管人员参加，并由注册会计师亲自盘点和监盘,注册会计师在分配财务报表项目重要性水平时考虑到由于货币资金是企业流动 性最强的资产，企业必须加强对货币资金的管理，并建立良好的货币资金内部控制以防 止错报及舞弊的发生，所以应从严制定货币资金的重要性水平,第十二章 货币资金的审计,ABC,选项 A，盘点库存现金的时间应视被审计单位的具体情况而定，最好选择在上午上班前或下午下班时进行，但是并不是必须安排在上午上班前或 下午下班时进行;选项 B，对于货币资金业务中重要的货币资金支付业务，公司应当实行集体决策和审批，并建立责任追究制度，防范贪污、侵占、挪用货币资金等行为;选 项 C，注册会计师只是对盘点的库存现金进行监盘，而不是亲自盘点，库存现金的盘点由出纳进行，会计主管复盘。【知识点】库存现金的实质性程序 现金监盘,<a href="http://www.zgcjpx.com/cpa/tiku/lianxi/sj/135970.html">2020年注册会计师考试《审计》每日一练(7-8)</a>,多选 审计
监盘库存现金是证实资产负债表中所列库存现金是否存在的一项重要程序，还可 以实现的审计目标有( )。,计价和分摊,完整性,在财务报表中恰当披露,权利和义务,第十二章 货币资金的审计,ABD,监盘库存现金不能实现被审计单位的货币资金是否在财务 报表中做出恰当披露。【知识点】库存现金的实质性程序,<a href="http://www.zgcjpx.com/cpa/tiku/lianxi/sj/135970.html">2020年注册会计师考试《审计》每日一练(7-8)</a>,多选 审计
当被审计单位的现金交易比例较高时，注册会计师应当实施的审计程序包括( )。,了解和评价被审计单位现金交易的内部控制,结合被审计单位的业务循环，分析评价现金交易的合理性,进行库存现金监盘,检查大额现金收支，核对交易真实性,第十二章 货币资金的审计,ABD,库存现金监盘能确认监盘时点现金的存在，对现金交易无效。【知识点】库存现金的实质性程序,<a href="http://www.zgcjpx.com/cpa/tiku/lianxi/sj/135970.html">2020年注册会计师考试《审计》每日一练(7-8)</a>,多选 审计
针对库存现金监盘，被审计单位下列人员中，应当参加库存现金监盘的有( )。,现金出纳员,财务总监,会计主管,董事长秘书,第十二章 货币资金的审计,AC,企业盘点库存现金，被审计单位的现金出纳员和会计主管人员必须参加，出纳员盘点，注册会计师监盘。【知识点】库存现金的监盘,<a href="http://www.zgcjpx.com/cpa/tiku/lianxi/sj/135970.html">2020年注册会计师考试《审计》每日一练(7-8)</a>,多选 审计
针对银行存款账户发生额，以下程序中，恰当的有( )。,函证银行账户,如果对被审计单位银行对账单的真实性存有疑虑，注册会计师可以在被审计单位 的协助下亲自到银行获取银行对账单，并全程关注银行对账单的打印过程,从银行对账单中选取交易的样本与被审计单位银行日记账记录进行核对，从被审 计单位银行存款日记账上选取样本，核对至银行对账单,分析不同账户发生银行日记账漏记银行交易的可能性，获取相关账户相关期间的 全部银行对账单,第十二章 货币资金的审计,ABCD,针对检查银行存款账户发生额的真实性，除实施函证(选项 A)等审计程序外，注册会计师还可以考虑对银行存款账户的发生额实施以下程序：(1) 分析不同账户发生银行日记账漏记银行交易的可能性，获取相关账户相关期间的全部银行对账单(选项 D);(2)如果对被审计单位银行对账单的真实性存有疑虑， 注册会计师可以在被审计单位的协助下亲自到银行获取银行对账单，并要全程关注银行 对账单的打印过程(选项 B);(3)从银行对账单中选取交易的样本与被审计单位银行日记账记录进行核对;从被审计单位银行存款日记账上选取样本，核对至银行对账单(选项 C);(4)浏览银行对账单，选取大额异常交易，如银行对账单上有一收一付相同金额，或分次转出相同金额等，检查被审计单位银行存款日记账上有无该项收付金 额记录。【知识点】银行存款的实质性程序,<a href="http://www.zgcjpx.com/cpa/tiku/lianxi/sj/135970.html">2020年注册会计师考试《审计》每日一练(7-8)</a>,多选 审计
